{
  "step_id": "S8",
  "status": "pending_review",
  "case_id": "demo-case-001",
  "case_name": "借贷合同纠纷案",
  "generated_at": "2026-05-23T10:00:00+08:00",
  "fact_findings": [
    {
      "fact_id": "S8-F001",
      "fact_content": "借款合同是当事人真实意思，刘某已实际交付了借款",
      "preliminary_finding": "supported",
      "review_status": "pending_review",
      "finding_basis": "借据+转账凭证相互印证",
      "evidence_support": [
        {"evidence_id": "E001", "evidence_description": "借据"},
        {"evidence_id": "E002", "evidence_description": "转账交易凭证"}
      ],
      "related_issue": "争点1"
    },
    {
      "fact_id": "S8-F002",
      "fact_content": "借款期间已届满",
      "preliminary_finding": "supported",
      "review_status": "pending_review",
      "finding_basis": "借据记载借款期限",
      "evidence_support": [
        {"evidence_id": "E001", "evidence_description": "借据"}
      ],
      "related_issue": "争点2"
    },
    {
      "fact_id": "S8-F003",
      "fact_content": "黄某偿还了数额为7万元的借款",
      "preliminary_finding": "supported",
      "review_status": "pending_review",
      "finding_basis": "转账交易凭证证明",
      "evidence_support": [
        {"evidence_id": "E002", "evidence_description": "转账交易凭证"}
      ],
      "related_issue": "争点3"
    },
    {
      "fact_id": "S8-F004",
      "fact_content": "无证据表明刘某明知黄某私盖了张某私章",
      "preliminary_finding": "unclear",
      "review_status": "pending_review",
      "finding_basis": "无证据证明刘某明知",
      "evidence_support": [],
      "related_issue": "争点6"
    }
  ],
  "evidence_evaluation": [
    {
      "evidence_id": "E001",
      "source_evidence_ids": ["E001"],
      "admissibility": {
        "preliminary_value": "admissible",
        "review_status": "pending_review",
        "basis": "书证，应予采纳"
      },
      "relevance": {
        "preliminary_value": "highly_relevant",
        "review_status": "pending_review",
        "basis": "直接证明借款合同关系"
      },
      "probative_value": {
        "preliminary_value": "strong",
        "review_status": "pending_review",
        "basis": "证据之间可相互印证"
      },
      "weight": {
        "weight_level": "high",
        "suggested_score": null,
        "review_status": "pending_review",
        "basis": "核心证据，直接证明待证事实"
      },
      "evaluation_notes": "借据为借款合同关系的直接证据"
    },
    {
      "evidence_id": "E002",
      "source_evidence_ids": ["E002"],
      "admissibility": {
        "preliminary_value": "admissible",
        "review_status": "pending_review",
        "basis": "书证，应予采纳"
      },
      "relevance": {
        "preliminary_value": "highly_relevant",
        "review_status": "pending_review",
        "basis": "直接证明借款交付和部分还款"
      },
      "probative_value": {
        "preliminary_value": "strong",
        "review_status": "pending_review",
        "basis": "银行转账凭证，证明力强"
      },
      "weight": {
        "weight_level": "high",
        "suggested_score": null,
        "review_status": "pending_review",
        "basis": "转账凭证直接证明款项交付"
      },
      "evaluation_notes": "转账交易凭证为借款合同履行的直接证据"
    }
  ],
  "burden_result": {
    "party_sufficient": {
      "plaintiff": {
        "preliminary_sufficiency": "sufficient",
        "review_status": "pending_review",
        "notes": "原告已完成借据和转账凭证举证"
      },
      "defendant": {
        "preliminary_sufficiency": "unclear",
        "review_status": "pending_review",
        "notes": "被告关于刘某知情的抗辩无证据支持"
      }
    },
    "facts_undetermined": [
      {
        "fact_id": "S8-F004",
        "fact_content": "刘某是否明知黄某私盖张某私章",
        "burden_bearer": "defendant",
        "burden_rule_applied": "由负有举证责任的当事人承担不利后果",
        "consequence_statement": "由负有举证责任的当事人承担不利后果"
      }
    ],
    "burden_applied_summary": "原告就借款合同成立、交付及部分还款已完成举证；被告就其抗辩主张（刘某知情）未能举证"
  },
  "review_required": {
    "evidence_evaluation_needs_review": true,
    "burden_result_needs_review": true,
    "facts_undetermined_needs_review": true
  },
  "references": {
    "s7_burden_allocation_ref": "intermediate/原告九步法/S7-举证责任/S7-举证责任.md",
    "s7_judicial_disclosure_ref": "intermediate/原告九步法/S7-举证责任/S7-举证责任.md",
    "s7_proof_resource_review_ref": "intermediate/原告九步法/S7-举证责任/S7-举证责任.md",
    "s7_reference_status": "resolved"
  }
}